ProductID,Category,Subcategory,Brand,ProductFeatures,Price (INR),Festivals,Seasons
P001,Electronics,Smartphones,Samsung,"6.7-inch AMOLED, 256GB Storage, 5G, 5000mAh Battery",32332,Eid,"Winter, Summer"
P002,Books,Fiction,HarperCollins,"Paperback, Mystery Thriller, 320 Pages, Bestseller",135,"Baisakhi, Raksha Bandhan, Ganesh Chaturthi","Spring, Monsoon"
P003,Clothing,Activewear,Nike,"Dri-FIT Fabric, Mens Running Shorts, Size M-XXL",348,"Diwali, Holi","Monsoon, Summer"
P004,Beauty,Skincare,CeraVe,"Hydrating Facial Cleanser, Fragrance-Free, 16oz",301,"Pongal, Ganesh Chaturthi, Raksha Bandhan","Summer, Spring, Autumn"
P005,Electronics,Laptops,Apple,"MacBook Pro 14-inch, M2 Pro Chip, 1TB SSD",37087,"Diwali, Baisakhi, Christmas","Winter, Monsoon, Summer"
P006,Home & Kitchen,Blenders,Vitamix,"Professional Series 750, 64oz Container, 10 Speeds",709,"Holi, Diwali","Spring, Autumn, Summer"
P007,Sports & Outdoors,Camping,Coleman,"6-Person Dome Tent, Weatherproof, UV Protection",903,Diwali,"Spring, Monsoon, Summer"
P008,Groceries,Snacks,Kind,"Dark Chocolate Almond Bars, Gluten-Free, 12-Pack",178,"Holi, Navratri","Winter, Summer, Autumn"
P009,Toys & Games,Board Games,Hasbro,"Monopoly Classic, Family Game Night, 2-8 Players",480,"Eid, Holi","Spring, Autumn"
P010,Fashion,Sunglasses,Ray-Ban,"Aviator Classic, Polarized Lenses, Gold Frame",127,Ganesh Chaturthi,"Summer, Monsoon"
P011,Electronics,Headphones,Sony,"WH-1000XM5, Noise-Cancelling, 30-Hour Battery",11713,Diwali,"Winter, Monsoon, Summer"
P012,Books,Non-Fiction,Penguin,"Sapiens: A Brief History of Humankind, Hardcover",807,"Holi, Eid","Autumn, Winter"
P013,Clothing,Formal Wear,Hugo Boss,"Mens Slim-Fit Suit, Wool Blend, Navy Blue",124,Navratri,"Spring, Autumn"
P014,Beauty,Makeup,Fenty Beauty,"Pro Filt'r Soft Matte Foundation, 50 Shades",279,"Christmas, Diwali, Navratri","Autumn, Summer"
P015,Home & Kitchen,Cookware,All-Clad,"Stainless Steel 10-Piece Set, Induction Compatible",685,Ganesh Chaturthi,"Spring, Monsoon, Winter"
P016,Sports & Outdoors,Yoga,manduka,"PRO Yoga Mat, Eco-Friendly, 6mm Thick",590,"Diwali, Ganesh Chaturthi, Holi","Monsoon, Summer"
P017,Groceries,Coffee,Lavazza,"Super Crema Whole Bean, Medium Roast, 2.2lb",298,"Onam, Baisakhi, Christmas","Autumn, Spring, Summer"
P018,Toys & Games,LEGO,LEGO,"Star Wars Millennium Falcon, 7,541 Pieces",630,"Holi, Diwali, Raksha Bandhan","Monsoon, Winter"
P019,Fashion,Watches,Casio,"G-Shock Mudmaster, Solar-Powered, Water Resistant",828,Eid,"Winter, Spring, Summer"
P020,Electronics,Tablets,Microsoft,"Surface Pro 9, 13-inch Touchscreen, 512GB SSD",1318,Diwali,"Winter, Monsoon"
P021,Home & Kitchen,Vacuum Cleaners,Dyson,"V15 Detect Cordless, Laser Dust Detection",825,"Navratri, Diwali","Winter, Spring, Autumn"
P022,Automotive,Tires,Michelin,"Defender All-Season, 225/65R17, 80k Mile Warranty",728,Onam,"Monsoon, Winter"
P023,Electronics,Smartwatches,Garmin,"Fenix 7X, GPS, Heart Rate Monitor",17672,Holi,"Winter, Monsoon, Summer"
P024,Clothing,Outerwear,The North Face,"Mens Thermoball Eco Jacket, Water-Resistant",240,"Raksha Bandhan, Holi, Navratri","Summer, Winter, Spring"
P025,Beauty,Hair Care,Olaplex,"No. 3 Hair Perfector, Repair Damaged Hair, 3.3oz",961,Navratri,"Winter, Summer"
P026,Books,Science Fiction,Orbit,"Dune: Frank Herbert, Paperback, 896 Pages",571,Diwali,"Autumn, Monsoon, Winter"
P027,Home & Kitchen,Air Fryers,Philips,"Premium XXL, 6.2qt Capacity, 7 Presets",183,"Baisakhi, Christmas, Onam","Autumn, Monsoon, Winter"
P028,Sports & Outdoors,Running,Saucony,"Ride 15 Running Shoes, Cushioned, Mens Size 10",187,Pongal,"Winter, Autumn, Spring"
P029,Groceries,Tea,Twinings,"English Breakfast Tea Bags, 100 Count",863,"Ganesh Chaturthi, Onam, Diwali","Spring, Winter, Monsoon"
P030,Fashion,Handbags,Kate Spade,"Crossbody Bag, Leather, Rose Gold Hardware",643,Diwali,"Spring, Autumn"
P031,Electronics,Gaming Consoles,Sony,"PlayStation 5, 825GB SSD, 4K Gaming",40549,Diwali,"Winter, Monsoon"
P032,Books,Biography,Simon & Schuster,"Becoming by Michelle Obama, Hardcover",1122,"Holi, Eid","Winter, Autumn"
P033,Clothing,Swimwear,Speedo,"Womens Solid One-Piece Swimsuit, Chlorine-Resistant",583,Holi,"Summer, Spring"
P034,Beauty,Perfume,Chanel,"Coco Mademoiselle Eau de Parfum, 3.4oz",976,"Christmas, Eid, Holi","Autumn, Monsoon"
P035,Home & Kitchen,Mattresses,Casper,"Original Hybrid, Queen Size, Medium Firmness",441,Navratri,"Autumn, Summer, Winter"
P036,Sports & Outdoors,Camping,Yeti,"Rambler 20oz Tumbler, Vacuum Insulated",597,"Diwali, Christmas","Summer, Autumn, Winter"
P037,Groceries,Pasta,Barilla,"Spaghetti Pasta, 16oz, Non-GMO",846,Diwali,"Spring, Summer"
P038,Toys & Games,Puzzles,Ravensburger,"Disney Villainous Board Game, Strategy Game",657,Baisakhi,"Winter, Summer, Monsoon"
P039,Fashion,Sneakers,Adidas,"Ultraboost 22 Running Shoes, Womens Size 8",876,"Christmas, Diwali, Pongal","Autumn, Monsoon, Spring"
P040,Electronics,Speakers,JBL,"Flip 6 Portable Bluetooth Speaker, Waterproof",29290,"Raksha Bandhan, Christmas","Monsoon, Summer"
P041,Electronics,Monitors,LG,"UltraGear 27-inch 4K, 144Hz Refresh Rate",35524,Diwali,"Summer, Monsoon"
P042,Books,Cookbooks,Chronicle Books,"Salt Fat Acid Heat, Hardcover, Illustrated",164,Eid,"Autumn, Monsoon"
P043,Clothing,Denim,Levi's,"501 Original Fit Jeans, Mens 32x34, Stretch Fabric",305,"Diwali, Pongal, Ganesh Chaturthi","Monsoon, Spring"
P044,Beauty,Sunscreen,Neutrogena,"Ultra Sheer Dry-Touch SPF 50, 3oz",360,Holi,"Summer, Autumn"
P045,Home & Kitchen,Toasters,KitchenAid,"2-Slice Toaster, Stainless Steel, 7 Shade Settings",172,Diwali,"Autumn, Winter, Spring"
P046,Sports & Outdoors,Golf,Callaway,Strata Ultimate 16-Piece Complete Golf Set,310,Holi,"Summer, Autumn, Monsoon"
P047,Groceries,Olive Oil,Bertolli,"Extra Virgin Olive Oil, 33.8oz",191,"Holi, Raksha Bandhan","Autumn, Summer"
P048,Toys & Games,Dolls,American Girl,"Truly Me Doll, 18-inch, Customizable",350,Ganesh Chaturthi,"Autumn, Summer, Winter"
P049,Fashion,Jewelry,Tiffany & Co.,"Return to Tiffany Heart Tag Pendant, Sterling Silver",672,"Pongal, Navratri, Diwali","Summer, Winter, Monsoon"
P050,Electronics,Printers,HP,"OfficeJet Pro 9015e, Wireless, All-in-One",18877,"Raksha Bandhan, Christmas","Winter, Monsoon, Summer"
P051,Electronics,Drones,DJI,"Mavic 3 Pro, 4K Camera, 46-Min Flight Time",19139,Ganesh Chaturthi,"Winter, Summer, Monsoon"
P052,Books,Children's,Scholastic,"Harry Potter Box Set, 7 Books, Paperback",393,Christmas,"Monsoon, Autumn"
P053,Clothing,Workwear,Carhartt,"Mens Duck Detachable Jacket, Sandstone",340,"Navratri, Eid","Spring, Winter, Autumn"
P054,Beauty,Makeup Brushes,Real Techniques,"Everyday Essentials Set, 5 Brushes",943,Diwali,"Summer, Winter"
P055,Home & Kitchen,Coffee Makers,DeLonghi,"Espresso Machine, 15-Bar Pump",683,Diwali,"Summer, Autumn, Spring"
P056,Sports & Outdoors,Cycling,Specialized,"Sirrus X 3.0 Fitness Bike, 21-Speed",648,"Diwali, Ganesh Chaturthi, Holi","Monsoon, Autumn"
P057,Groceries,Cereal,Kellogg's,"Frosted Flakes, Family Size, 24oz",254,"Navratri, Onam","Autumn, Spring"
P058,Toys & Games,Remote Control,Traxxas,"Slash 4x4 RC Truck, 1/10 Scale",756,"Holi, Eid, Christmas","Spring, Summer"
P059,Fashion,Luggage,Samsonite,"Winfield 2 Hardside Spinner, 28-inch",247,Holi,"Winter, Spring, Summer"
P060,Electronics,Keyboards,Logitech,"MX Keys Wireless Keyboard, Backlit",19593,"Diwali, Holi, Baisakhi","Summer, Monsoon, Winter"
P061,Electronics,Projectors,Epson,"Home Cinema 2250, 4K PRO-UHD, 3000 Lumens",49487,Christmas,"Monsoon, Winter, Summer"
P062,Books,Fantasy,Tor Books,"The Way of Kings by Brandon Sanderson, Hardcover",996,"Ganesh Chaturthi, Pongal","Monsoon, Spring"
P063,Clothing,Winter Hats,The North Face,"Thermoball Eco Beanie, Fleece Lined",601,"Christmas, Diwali","Spring, Monsoon, Autumn"
P064,Beauty,Lipstick,Mac,"Matte Lipstick, Ruby Woo, Long-Lasting",716,"Pongal, Navratri","Autumn, Winter, Monsoon"
P065,Home & Kitchen,Cookware,Le Creuset,"Dutch Oven, 5.5qt, Ceramic Coated",859,"Christmas, Pongal, Holi","Summer, Autumn, Winter"
P066,Sports & Outdoors,Hiking,Merrell,"Moab 3 Hiking Shoes, Waterproof, Mens Size 11",798,"Diwali, Holi, Eid","Winter, Spring"
P067,Groceries,Snack Bars,RXBAR,"Chocolate Sea Salt, 12-Pack, No Added Sugar",306,Christmas,"Summer, Spring"
P068,Toys & Games,STEM Toys,LEGO,"Mindstorms Robot Inventor Kit, 949 Pieces",129,"Pongal, Diwali","Autumn, Spring, Summer"
P069,Fashion,Belts,Gucci,"GG Supreme Web Belt, Gold Buckle, Size 90",384,"Navratri, Eid, Holi","Summer, Monsoon, Winter"
P070,Electronics,External Hard Drives,Seagate,"Backup Plus 5TB, USB 3.0, Portable",14119,Diwali,"Monsoon, Summer"
P071,Electronics,Smart Home,Google,"Nest Learning Thermostat, Programmable",11338,"Holi, Onam, Ganesh Chaturthi","Monsoon, Summer"
P072,Books,History,Random House,"A People's History of the United States, Paperback",1420,Raksha Bandhan,"Spring, Autumn"
P073,Clothing,Yoga Pants,Lululemon,"Align High-Rise Pant, Womens Size 6, Nulu Fabric",889,"Eid, Baisakhi, Holi","Monsoon, Autumn"
P074,Beauty,Face Mask,Glow Recipe,"Watermelon Glow Sleeping Mask, 2.5oz",383,"Navratri, Holi, Diwali","Winter, Monsoon"
P075,Home & Kitchen,Microwaves,Panasonic,"1.2cu ft Countertop Microwave, 1100W",690,"Ganesh Chaturthi, Navratri, Diwali","Spring, Monsoon, Winter"
P076,Sports & Outdoors,Fitness,TRX,"All-in-One Suspension Training Kit, Home Gym",456,"Holi, Onam","Monsoon, Winter"
P077,Groceries,Honey,Sue Bee,"Pure Clover Honey, 32oz Squeeze Bottle",923,"Holi, Diwali","Summer, Autumn, Spring"
P078,Toys & Games,Action Figures,Marvel,"Avengers Endgame Titan Hero Series, 12-inch",513,"Navratri, Baisakhi, Holi","Autumn, Summer"
P079,Fashion,Wallets,Fossil,"Mens Bi-Fold Wallet, RFID Blocking, Leather",338,Raksha Bandhan,"Monsoon, Autumn"
P080,Electronics,Earbuds,Apple,"AirPods Pro (2nd Gen), Noise Cancelling, MagSafe",13085,Christmas,"Summer, Monsoon"
P081,Electronics,Gaming Chairs,Secretlab,"Titan Evo 2022, Leather, Adjustable Lumbar",28507,"Holi, Raksha Bandhan","Summer, Monsoon"
P082,Books,Romance,Avon,"The Spanish Love Deception, Paperback",468,"Eid, Ganesh Chaturthi","Monsoon, Spring, Winter"
P083,Clothing,Socks,Bombas,"Merino Wool Hiking Socks, Cushioned, Mens Size 9-11",626,"Ganesh Chaturthi, Navratri","Spring, Autumn, Summer"
P084,Beauty,Eye Cream,Kiehl's,"Avocado Eye Cream, Hydrating, 0.5oz",908,"Diwali, Christmas, Holi","Winter, Autumn, Summer"
P085,Home & Kitchen,Food Storage,OXO,"10-Piece Pop Container Set, Airtight",459,Diwali,"Spring, Winter, Monsoon"
P086,Sports & Outdoors,Fishing,Shimano,"Stradic FL Spinning Reel, Saltwater Ready",297,"Diwali, Ganesh Chaturthi","Monsoon, Winter, Summer"
P087,Groceries,Nuts,Blue Diamond,"Almonds, Smokehouse Flavor, 16oz Can",998,"Raksha Bandhan, Diwali, Navratri","Monsoon, Summer, Autumn"
P088,Toys & Games,Plush Toys,Squishmallows,"16-inch Cam the Cat, Ultra-Soft",559,"Holi, Ganesh Chaturthi","Summer, Spring"
P089,Fashion,Hats,New Era,"MLB New York Yankees 59FIFTY Fitted Cap, Black",182,Diwali,"Winter, Autumn, Monsoon"
P090,Electronics,Tablet Accessories,Apple,"Apple Pencil (2nd Gen), Magnetic Charging",3309,Raksha Bandhan,"Monsoon, Summer"
P091,Electronics,VR Headsets,Meta,"Meta Quest 3, 128GB, Mixed Reality",6373,"Eid, Onam","Summer, Monsoon, Winter"
P092,Books,Self-Help,Penguin,"Atomic Habits by James Clear, Paperback",978,"Diwali, Holi, Baisakhi","Monsoon, Autumn, Winter"
P093,Clothing,Base Layers,Patagonia,"Capilene Midweight Top, Mens Size Large",813,Pongal,"Monsoon, Winter, Summer"
P094,Beauty,Body Lotion,Nivea,"Intensive Care, 48-Hour Moisture, 16.9oz",480,Holi,"Winter, Spring, Autumn"
P095,Home & Kitchen,Air Purifiers,Dyson,"Pure Cool TP07, HEPA Filter, Wi-Fi Enabled",157,Raksha Bandhan,"Winter, Spring"
P096,Sports & Outdoors,Water Bottles,Hydro Flask,"32oz Wide Mouth, Vacuum Insulated",443,"Christmas, Ganesh Chaturthi","Autumn, Monsoon, Spring"
P097,Groceries,Crackers,Cheez-It,"Original Baked Snack Crackers, 21oz",997,"Navratri, Holi, Diwali","Winter, Autumn, Monsoon"
P098,Toys & Games,Model Kits,Revell,"Apollo Saturn V Rocket Model, 1:144 Scale",576,"Pongal, Onam, Ganesh Chaturthi","Spring, Summer, Winter"
P099,Fashion,Scarves,Burberry,"Classic Check Cashmere Scarf, Beige",974,"Holi, Raksha Bandhan, Onam","Autumn, Summer, Monsoon"
P100,Electronics,Chargers,Anker,"USB-C 100W Charger, GaN Technology, 4 Ports",43178,"Pongal, Christmas, Ganesh Chaturthi","Winter, Summer, Monsoon"
P101,Electronics,Webcams,Logitech,"C922 Pro Stream Webcam, 1080p, Built-in Mic",1563,"Diwali, Pongal, Raksha Bandhan","Monsoon, Summer"
P102,Books,Poetry,Penguin Classics,"The Odyssey by Homer, Paperback, Translated",1109,"Diwali, Raksha Bandhan","Winter, Monsoon, Spring"
P103,Clothing,Underwear,Calvin Klein,"Cotton Stretch Boxer Briefs, 3-Pack",714,"Diwali, Ganesh Chaturthi","Monsoon, Spring, Autumn"
P104,Beauty,Nail Polish,Essie,"Gel Couture Longwear, Ballet Slippers, 0.5oz",583,"Raksha Bandhan, Holi, Christmas","Monsoon, Autumn"
P105,Home & Kitchen,Mixers,KitchenAid,"Artisan Series 5-Qt Stand Mixer, Empire Red",340,"Holi, Raksha Bandhan, Ganesh Chaturthi","Monsoon, Winter"
P106,Sports & Outdoors,Skateboarding,Element,"Maple Wood Complete Skateboard, 8-inch",677,"Christmas, Raksha Bandhan","Autumn, Monsoon"
P107,Groceries,Spices,McCormick,"Grill Mates Montreal Steak Seasoning, 21oz",200,"Ganesh Chaturthi, Diwali","Spring, Monsoon, Winter"
P108,Toys & Games,Card Games,UNO,"Classic Card Game, Family-Friendly, 108 Cards",491,"Eid, Holi, Baisakhi","Monsoon, Summer, Winter"
P109,Fashion,Ties,Tom Ford,"Silk Necktie, Slim Fit, Navy Blue",508,"Eid, Pongal, Ganesh Chaturthi","Spring, Autumn"
P110,Electronics,Power Banks,RAVPower,"26800mAh Portable Charger, USB-C PD 30W",47737,"Christmas, Navratri","Winter, Summer"
P111,Electronics,Smart Lights,Philips Hue,White & Color Ambiance LED Starter Kit,43917,Ganesh Chaturthi,"Summer, Winter, Monsoon"
P112,Books,Travel Guides,Lonely Planet,"Japan Travel Guide, 15th Edition",469,"Navratri, Diwali, Raksha Bandhan","Spring, Winter, Autumn"
P113,Clothing,Scrubs,FIGS,"V-Neck Scrub Top, Womens Size Small, Stretch Fabric",551,Holi,"Spring, Autumn"
P114,Beauty,Shampoo,Head & Shoulders,"Dandruff Shampoo, Smooth & Silky, 28oz",261,"Diwali, Ganesh Chaturthi, Baisakhi","Monsoon, Autumn, Spring"
P115,Home & Kitchen,Cutlery,Henckels,Forged Premio 15-Piece Knife Block Set,921,"Baisakhi, Onam, Eid","Monsoon, Spring"
P116,Sports & Outdoors,Baseball,Wilson,"MLB Official Baseball, Synthetic Leather",883,"Diwali, Onam, Eid","Spring, Summer"
P117,Groceries,Peanut Butter,Jif,"Creamy Peanut Butter, 40oz Jar",369,"Baisakhi, Pongal, Holi","Summer, Autumn"
P118,Toys & Games,Science Kits,National Geographic,"Break Open 10 Geodes, STEM Kit",675,Eid,"Monsoon, Spring, Summer"
P119,Fashion,Briefcases,Tumi,"Alpha 3 Expandable Briefcase, Ballistic Nylon",648,"Pongal, Holi","Summer, Monsoon"
P120,Electronics,Graphic Tablets,Wacom,"Intuos Pro Large, Bluetooth, Pressure Sensitive",8489,"Diwali, Ganesh Chaturthi","Summer, Monsoon, Winter"
P121,Electronics,Security Cameras,Ring,"Floodlight Cam Wired Pro, Motion Detection",38363,Onam,"Winter, Summer, Monsoon"
P122,Books,Art & Photography,Taschen,Vincent van Gogh: The Complete Paintings,855,"Raksha Bandhan, Ganesh Chaturthi","Spring, Winter, Autumn"
P123,Clothing,Jackets,Canada Goose,"Expedition Parka, Arctic-Tech Fabric, Mens XL",801,"Diwali, Ganesh Chaturthi","Winter, Summer"
P124,Beauty,Face Wash,La Roche-Posay,"Toleriane Hydrating Gentle Cleanser, 13.5oz",577,"Baisakhi, Diwali","Spring, Autumn, Winter"
P125,Home & Kitchen,Dehumidifiers,hOmeLabs,"4,500 Sq Ft Capacity, 50-Pint, Quiet",101,"Navratri, Pongal","Autumn, Summer"
P126,Sports & Outdoors,Tennis,Wilson,Pro Staff RF97 v13 Tennis Racket,392,"Raksha Bandhan, Ganesh Chaturthi","Monsoon, Autumn, Winter"
P127,Groceries,Trail Mix,Planters,"Nuts & Chocolate, 34oz Canister",118,"Eid, Holi, Christmas","Winter, Monsoon, Summer"
P128,Toys & Games,Building Sets,Magna-Tiles,"Clear Colors 100-Piece Set, Magnetic",936,Christmas,"Summer, Monsoon"
P129,Fashion,Slippers,Ugg,"Scuffette II Slippers, Womens Size 7, Shearling",891,"Pongal, Onam","Spring, Summer"
P130,Electronics,Microphones,Blue Yeti,"USB Microphone, Cardioid Pattern, Plug & Play",41752,"Navratri, Christmas","Summer, Winter"
P131,Electronics,Routers,TP-Link,"Archer AX6000, Wi-Fi 6, Dual-Band",16068,"Ganesh Chaturthi, Raksha Bandhan","Monsoon, Winter"
P132,Books,Business,Portfolio,"The Lean Startup by Eric Ries, Paperback",181,"Christmas, Pongal, Holi","Winter, Spring, Autumn"
P133,Clothing,Dresses,Reformation,"Satin Slip Dress, Womens Size 4, Mid-Length",890,"Eid, Diwali","Winter, Summer, Monsoon"
P134,Beauty,Serum,The Ordinary,"Hyaluronic Acid 2% + B5, 1oz",952,"Ganesh Chaturthi, Diwali","Spring, Winter"
P135,Home & Kitchen,Blinds,Blinds.com,"Cordless Light Filtering Cellular Shades, 36x48",177,Navratri,"Winter, Monsoon, Summer"
P136,Sports & Outdoors,Soccer,Adidas,"Copa Mundial Soccer Cleats, Leather, Mens 10",537,"Navratri, Holi, Ganesh Chaturthi","Monsoon, Summer"
P137,Groceries,Chips,Lays,"Classic Potato Chips, Family Size, 10oz",162,"Diwali, Pongal","Spring, Summer"
P138,Toys & Games,Dinosaur Toys,Schleich,"T-Rex Dinosaur Figure, Realistic Detailing",785,Eid,"Autumn, Summer, Spring"
P139,Fashion,Pajamas,Victoria's Secret,"Cotton Pajama Set, Womens Size Medium",789,Diwali,"Summer, Winter, Monsoon"
P140,Electronics,SSD,Samsung,"980 PRO 2TB NVMe M.2 SSD, 7,000MB/s",7291,Navratri,"Winter, Summer, Monsoon"
P141,Electronics,Smart Plugs,Amazon,"Smart Plug, Works with Alexa, 4-Pack",24289,Christmas,"Summer, Winter"
P142,Books,Manga,Viz Media,"Demon Slayer: Kimetsu no Yaiba, Vol. 1",870,"Holi, Ganesh Chaturthi","Autumn, Spring"
P143,Clothing,Skirts,Zara,"Pleated Midi Skirt, Womens Size 6, Polyester",339,Diwali,"Winter, Autumn, Monsoon"
P144,Beauty,Eye Shadow,Urban Decay,"Naked3 Palette, 12 Rosy Neutral Shades",885,"Diwali, Navratri, Raksha Bandhan","Autumn, Summer"
P145,Home & Kitchen,Grills,Weber,"Spirit II E-310 Gas Grill, 3 Burners",481,"Raksha Bandhan, Baisakhi, Navratri","Autumn, Spring, Summer"
P146,Sports & Outdoors,Swimming,Speedo,"Vanquisher 2.0 Swim Goggles, Anti-Fog",291,"Holi, Christmas","Winter, Summer"
P147,Groceries,Energy Drinks,Monster,"Original Green, 16oz Can, 24-Pack",585,Holi,"Monsoon, Spring"
P148,Toys & Games,Puppets,Folkmanis,"Gray Wolf Hand Puppet, Realistic Design",757,"Eid, Diwali, Baisakhi","Autumn, Monsoon"
P149,Fashion,Backpacks,Herschel,"Little America Backpack, 25L, Water-Resistant",281,Christmas,"Autumn, Summer"
P150,Electronics,Cables,Belkin,"USB-C to HDMI Cable, 6ft, 4K 60Hz",16274,"Raksha Bandhan, Eid, Diwali","Monsoon, Winter"
P151,Electronics,Solar Panels,Jackery,"SolarSaga 100W, Foldable, Portable",49762,"Diwali, Holi, Navratri","Winter, Monsoon"
P152,Books,Graphic Novels,DC Comics,"Batman: The Killing Joke, Deluxe Edition",1010,"Raksha Bandhan, Holi, Baisakhi","Autumn, Spring, Winter"
P153,Clothing,Shorts,Under Armour,"Mens Tech 9-inch Shorts, Moisture-Wicking",494,"Raksha Bandhan, Ganesh Chaturthi","Autumn, Spring, Summer"
P154,Beauty,Deodorant,Dove,"0% Aluminum, Sensitive Skin, 3.8oz",566,"Ganesh Chaturthi, Eid, Holi","Winter, Summer"
P155,Home & Kitchen,Curtains,IKEA,"Ritva Blackout Curtains, 57x98-inch, Pair",209,Eid,"Autumn, Monsoon, Winter"
P156,Sports & Outdoors,Boxing,Everlast,"Pro Style Training Gloves, Mens Large",302,"Christmas, Diwali","Spring, Summer"
P157,Groceries,Water,Evian,"Natural Spring Water, 1.5L Bottles, 12-Pack",404,"Diwali, Holi","Summer, Winter"
P158,Toys & Games,Magic Kits,Melissa & Doug,"Magic Set with 10 Tricks, Age 8+",629,"Pongal, Raksha Bandhan, Navratri","Summer, Spring"
P159,Fashion,Shawls,Hermès,"Twilly Silk Scarf, Hand-Rolled Edges",307,"Diwali, Navratri","Autumn, Spring, Winter"
P160,Electronics,Calculators,Texas Instruments,TI-84 Plus CE Graphing Calculator,11791,"Navratri, Diwali, Eid","Monsoon, Summer, Winter"
P161,Electronics,VR Accessories,Oculus,"Meta Quest 2 Elite Strap, Adjustable",4479,Eid,"Monsoon, Winter"
P162,Books,Religion,Zondervan,"NIV Study Bible, Hardcover, Full-Color Maps",984,"Ganesh Chaturthi, Diwali","Monsoon, Autumn"
P163,Clothing,T-Shirts,Uniqlo,"Supima Cotton Crew Neck, Mens Size Medium",306,"Eid, Ganesh Chaturthi, Navratri","Spring, Summer, Autumn"
P164,Beauty,Body Wash,Dove,"Deep Moisture Body Wash, 22oz Pump",915,"Pongal, Raksha Bandhan","Winter, Monsoon"
P165,Home & Kitchen,Food Processors,Cuisinart,14-Cup Elemental Food Processor,874,"Diwali, Raksha Bandhan","Summer, Autumn, Spring"
P166,Sports & Outdoors,Cycling,Giro,"Synthe MIPS Road Bike Helmet, Matte Black",164,Diwali,"Monsoon, Summer, Spring"
P167,Groceries,Yogurt,Chobani,"Greek Yogurt, Mixed Berry, 32oz Tub",314,"Ganesh Chaturthi, Onam, Holi","Summer, Winter"
P168,Toys & Games,Bubbles,Gazillion,"Bubble Hurricane Machine, 8-Ounce Solution",702,"Ganesh Chaturthi, Navratri, Baisakhi","Autumn, Summer, Monsoon"
P169,Fashion,Belts,Salvatore Ferragamo,"Gancini Reversible Belt, Black/Brown",293,Eid,"Autumn, Summer"
P170,Electronics,Electric Scooters,Xiaomi,"Mi Electric Scooter 4 Pro, 31mi Range",7483,Baisakhi,"Monsoon, Summer"
P171,Electronics,Wireless Mice,Microsoft,"Surface Precision Mouse, Bluetooth",46840,"Onam, Diwali, Holi","Winter, Summer, Monsoon"
P172,Books,Education,McGraw-Hill,"SAT Prep Book 2023, 5 Practice Tests",899,"Diwali, Raksha Bandhan","Monsoon, Winter"
P173,Clothing,Blazers,Banana Republic,"Mens Slim-Fit Blazer, Italian Wool, Navy",525,Diwali,"Winter, Spring, Monsoon"
P174,Beauty,Face Oil,Biossance,"Squalane + Vitamin C Rose Oil, 1oz",806,Holi,"Monsoon, Summer"
P175,Home & Kitchen,Bakeware,Williams Sonoma,Goldtouch Nonstick Baking Sheet Set,827,"Christmas, Diwali","Autumn, Monsoon, Summer"
P176,Sports & Outdoors,Climbing,Black Diamond,"Momentum Climbing Shoes, Mens 9",271,"Christmas, Holi, Diwali","Autumn, Monsoon, Summer"
P177,Groceries,Canned Soup,Campbell's,"Chicken Noodle Soup, 10.75oz, 12-Pack",187,"Raksha Bandhan, Ganesh Chaturthi","Winter, Autumn, Summer"
P178,Toys & Games,Play Kitchens,KidKraft,"Ultimate Corner Play Kitchen, Wooden",488,Pongal,"Winter, Monsoon"
P179,Fashion,Necklaces,Swarovski,"Swan Pendant Necklace, Rhodium-Plated",481,"Raksha Bandhan, Christmas","Autumn, Spring"
P180,Electronics,USB Hubs,Anker,"7-in-1 USB-C Hub, 4K HDMI, SD Card Reader",23884,"Holi, Diwali, Christmas","Summer, Monsoon, Winter"
P181,Electronics,Electric Toothbrushes,Philips,"Sonicare 4100, Pressure Sensor",36725,Christmas,"Summer, Monsoon"
P182,Books,Thriller,St. Martin's Press,The Silent Patient by Alex Michaelides,1043,"Baisakhi, Eid","Spring, Autumn"
P183,Clothing,Leggings,Alo Yoga,"Airbrush High-Waist Leggings, Womens Size 8",986,"Eid, Christmas, Holi","Winter, Autumn"
P184,Beauty,Mascara,L'Oreal,"Voluminous Lash Paradise, Blackest Black",189,"Onam, Pongal, Eid","Winter, Spring, Summer"
P185,Home & Kitchen,Fire Pits,Solo Stove,"Bonfire 2.0, Smokeless, Stainless Steel",462,"Christmas, Diwali, Onam","Monsoon, Autumn"
P186,Sports & Outdoors,Running,Nike,"Air Zoom Pegasus 39, Womens Size 7.5",405,"Navratri, Christmas, Holi","Autumn, Monsoon, Summer"
P187,Groceries,Cookies,Oreo,"Double Stuf Chocolate Sandwich Cookies, 15.35oz",876,"Pongal, Eid, Diwali","Autumn, Winter, Spring"
P188,Toys & Games,Play Tents,Playwild,"Kids Pop-Up Tent with Tunnel, Dinosaur Theme",324,"Onam, Diwali, Holi","Spring, Autumn"
P189,Fashion,Earrings,Kendra Scott,"Elisa Pendant Earrings, Gold-Tone",271,Baisakhi,"Summer, Winter"
P190,Electronics,Car Chargers,AUKEY,"USB-C Car Charger, 30W, Dual Ports",22982,"Baisakhi, Ganesh Chaturthi, Eid","Monsoon, Summer, Winter"
P191,Electronics,Binoculars,Nikon,"Prostaff P7 10x42, Waterproof, Fogproof",21672,"Holi, Raksha Bandhan, Christmas","Monsoon, Winter"
P192,Books,Science,Oxford University Press,The Selfish Gene by Richard Dawkins,490,"Christmas, Diwali, Navratri","Spring, Winter, Monsoon"
P193,Clothing,Overalls,Carhartt,"Womens Relaxed Fit Dungaree Overalls, Denim",325,"Diwali, Navratri","Autumn, Winter, Monsoon"
P194,Beauty,BB Cream,Missha,"M Perfect Cover BB Cream, SPF 42, No. 21",931,Eid,"Autumn, Spring, Monsoon"
P195,Home & Kitchen,Trash Cans,Simplehuman,"Slim Plastic Step Trash Can, 10 Gallons",499,Pongal,"Monsoon, Summer"
P196,Sports & Outdoors,Surfing,Billabong,"Mens 3/2mm Wetsuit, Chest Zip",875,"Eid, Diwali","Monsoon, Winter, Autumn"
P197,Groceries,Cracked Pepper,McCormick,"Grinder, Coarse Ground, 2.12oz",595,"Diwali, Christmas, Ganesh Chaturthi","Summer, Winter"
P198,Toys & Games,Stuffed Animals,Jellycat,"Bashful Bunny, Medium, Cream Color",146,"Diwali, Christmas","Monsoon, Spring, Autumn"
P199,Fashion,Loafers,Gucci,"Horsebit Loafer, Leather, Mens Size 10",999,"Diwali, Christmas","Autumn, Winter"
P200,Electronics,Smart Displays,Amazon,"Echo Show 15, 15.6-inch, HD",41965,"Raksha Bandhan, Diwali","Winter, Summer, Monsoon"
P201,Electronics,Smartphones,Google,"Pixel 7 Pro, 6.7-inch OLED, 128GB, 5G",48481,Diwali,"Summer, Winter, Monsoon"
P202,Books,Fiction,Simon & Schuster,"Where the Crawdads Sing, Paperback, 384 Pages",1397,Baisakhi,"Spring, Monsoon"
P203,Clothing,Activewear,Under Armour,"Womens HeatGear Leggings, Moisture-Wicking",864,Eid,"Monsoon, Autumn"
P204,Beauty,Skincare,La Roche-Posay,"Toleriane Double Repair Face Moisturizer, 3.4oz",250,"Eid, Christmas, Onam","Monsoon, Winter, Summer"
P205,Electronics,Laptops,Dell,"XPS 15, 15.6-inch 4K Touchscreen, 1TB SSD",24796,"Baisakhi, Christmas, Eid","Summer, Winter"
P206,Home & Kitchen,Blenders,Ninja,"Professional Blender, 72oz Pitcher, 1500W",292,"Diwali, Christmas","Monsoon, Autumn"
P207,Sports & Outdoors,Camping,REI,"Co-op Half Dome SL 2+ Tent, Lightweight",461,Ganesh Chaturthi,"Monsoon, Winter, Spring"
P208,Groceries,Snacks,Clif Bar,"Energy Bars, Chocolate Chip, 12-Pack",153,Eid,"Winter, Autumn, Monsoon"
P209,Toys & Games,Board Games,Catan,"Catan Board Game, Strategy, 3-4 Players",441,"Onam, Diwali, Navratri","Spring, Monsoon, Autumn"
P210,Fashion,Sunglasses,Oakley,"Holbrook Sunglasses, Polarized, Matte Black",987,"Diwali, Navratri, Holi","Spring, Summer"
